{
  "id": "integration-example-procore",
  "kind": "integrations",
  "mvp_status": "Frozen for MVP",
  "sourceContractSection": "§18.0, §15.13.1",
  "sourceCatalogId": "OC-11",
  "validationRuleRefs": ["VR-10", "VR-11", "VR-12", "VR-13", "VR-14", "VR-15", "VR-16", "VR-17", "VR-20"],
  "ownerCategory": "IT / Integration Admin",
  "integrationName": "procore",
  "integrationKind": "project_management",
  "sourceSystem": "Procore",
  "classification": "operational",
  "configuredStatus": "Configured",
  "baseUrl": "https://api.example.invalid/procore",
  "lastHealthCheck": "2026-01-20T08:00:00Z",
  "lastHealthResult": "Pass",
  "noFullProcoreMirror": true,
  "noDirectSpfxToProcore": true,
  "noProcoreSecrets": true,
  "procoreMapping_ProjectId": "pid-26-000-00",
  "procoreMapping_ProcoreCompanyId": "5280",
  "procoreMapping_ProcoreProjectId": "fake-procore-project-id",
  "procoreMapping_ProcoreSyncEnabled": false,
  "procoreMapping_ConfiguredBy": "pm@example.invalid",
  "procoreSubjectAreaRegistry_SubjectArea": "project_management",
  "procoreSubjectAreaRegistry_Enabled": false,
  "procoreSubjectAreaRegistry_StorageTarget": "deep-link-only",
  "procoreSubjectAreaRegistry_ApiLifecycleStatus": "Stable",
  "procoreSyncHealth_Status": "NotRun",
  "procoreSyncHealth_RepairActionAvailable": false,
  "procoreIntegrationAudit_Action": "mapping_configured",
  "procoreIntegrationAudit_BeforeState": "{}",
  "procoreIntegrationAudit_AfterState": "{\"procoreMapping_ProcoreCompanyId\":\"5280\"}",
  "procoreDirectoryComparison_ReadOnly": true,
  "procoreWriteback_Deferred": true,
  "sageIntacct_ProjectId": "sage-000001"
}
